{
  "metadata": {
    "source": "MISRA C:2025 Addendum 6 - Applicability of MISRA C:2025 to the Rust Language",
    "version": "Working Draft March 2025",
    "isbn": "978-1-911700-22-7",
    "extracted_date": "2026-01-03",
    "total_guidelines": 228
  },
  "applicability_values": {
    "Yes": "The MISRA C guideline applies equally to the Rust language",
    "No": "The MISRA C guideline does not apply to the Rust language",
    "Partial": "The MISRA C guideline partially applies to some aspects of the Rust language"
  },
  "adjusted_category_values": {
    "required": "Code shall comply with this guideline, with a formal deviation required where this is not the case",
    "advisory": "These are recommendations which should be followed as far as is reasonably practical",
    "recommended": "Best practice recommendations",
    "disapplied": "Guidelines for which compliance is not required. No enforcement is expected",
    "implicit": "The behaviour is not permitted by Rust (compiler enforces)",
    "n_a": "The behaviour does not apply to Rust"
  },
  "rationale_values": {
    "UB": "The MISRA C guideline applies to C Undefined Behaviour",
    "IDB": "The MISRA C guideline applies to C Implementation-defined Behaviour",
    "CQ": "The MISRA C guideline applies to Code Quality considerations",
    "DC": "The MISRA C guideline applies to Design Considerations"
  },
  "decidability_values": {
    "Decidable": "Can be checked by static analysis",
    "Undecidable": "Cannot be fully checked by static analysis",
    "n/a": "Not applicable"
  },
  "scope_values": {
    "STU": "Single Translation Unit - analysis confined to one compilation unit",
    "System": "Requires system-wide analysis across multiple compilation units",
    "n/a": "Not applicable"
  },
  "guidelines": {
    "Dir 1.1": {
      "misra_category": "Required",
      "decidability": "n/a",
      "scope": "n/a",
      "rationale": [
        "IDB"
      ],
      "applicability_all_rust": "Yes",
      "applicability_safe_rust": "Yes",
      "adjusted_category": "required",
      "comment": ""
    },
    "Dir 1.2": {
      "misra_category": "Advisory",
      "decidability": "n/a",
      "scope": "n/a",
      "rationale": [
        "IDB"
      ],
      "applicability_all_rust": "Yes",
      "applicability_safe_rust": "Yes",
      "adjusted_category": "required",
      "comment": "previously Rule 1.2"
    },
    "Dir 2.1": {
      "misra_category": "Required",
      "decidability": "n/a",
      "scope": "n/a",
      "rationale": [
        "UB",
        "DC"
      ],
      "applicability_all_rust": "Yes",
      "applicability_safe_rust": "Yes",
      "adjusted_category": "required",
      "comment": ""
    },
    "Dir 3.1": {
      "misra_category": "Required",
      "decidability": "n/a",
      "scope": "n/a",
      "rationale": [
        "CQ"
      ],
      "applicability_all_rust": "Yes",
      "applicability_safe_rust": "Yes",
      "adjusted_category": "required",
      "comment": ""
    },
    "Dir 4.1": {
      "misra_category": "Required",
      "decidability": "n/a",
      "scope": "n/a",
      "rationale": [
        "CQ"
      ],
      "applicability_all_rust": "Yes",
      "applicability_safe_rust": "Yes",
      "adjusted_category": "required",
      "comment": "often in the form of panics"
    },
    "Dir 4.2": {
      "misra_category": "Advisory",
      "decidability": "n/a",
      "scope": "n/a",
      "rationale": [
        "CQ"
      ],
      "applicability_all_rust": "Yes",
      "applicability_safe_rust": "Yes",
      "adjusted_category": "required",
      "comment": ""
    },
    "Dir 4.3": {
      "misra_category": "Required",
      "decidability": "n/a",
      "scope": "n/a",
      "rationale": [
        "CQ"
      ],
      "applicability_all_rust": "Yes",
      "applicability_safe_rust": "Yes",
      "adjusted_category": "advisory",
      "comment": ""
    },
    "Dir 4.4": {
      "misra_category": "Advisory",
      "decidability": "n/a",
      "scope": "n/a",
      "rationale": [
        "DC"
      ],
      "applicability_all_rust": "Yes",
      "applicability_safe_rust": "Yes",
      "adjusted_category": "advisory",
      "comment": ""
    },
    "Dir 4.5": {
      "misra_category": "Advisory",
      "decidability": "n/a",
      "scope": "n/a",
      "rationale": [
        "DC"
      ],
      "applicability_all_rust": "Yes",
      "applicability_safe_rust": "Yes",
      "adjusted_category": "recommended",
      "comment": "“ambiguity” is determined by the project"
    },
    "Dir 4.6": {
      "misra_category": "Advisory",
      "decidability": "n/a",
      "scope": "n/a",
      "rationale": [
        "DC"
      ],
      "applicability_all_rust": "No",
      "applicability_safe_rust": "No",
      "adjusted_category": "n_a",
      "comment": "all primitive types already fulfil this"
    },
    "Dir 4.7": {
      "misra_category": "Required",
      "decidability": "n/a",
      "scope": "n/a",
      "rationale": [
        "DC"
      ],
      "applicability_all_rust": "Yes",
      "applicability_safe_rust": "Yes",
      "adjusted_category": "advisory",
      "comment": "prefer Option, Result, etc."
    },
    "Dir 4.8": {
      "misra_category": "Advisory",
      "decidability": "n/a",
      "scope": "n/a",
      "rationale": [
        "DC"
      ],
      "applicability_all_rust": "No",
      "applicability_safe_rust": "No",
      "adjusted_category": "n_a",
      "comment": ""
    },
    "Dir 4.9": {
      "misra_category": "Advisory",
      "decidability": "n/a",
      "scope": "n/a",
      "rationale": [
        "DC",
        "CQ"
      ],
      "applicability_all_rust": "Yes",
      "applicability_safe_rust": "Yes",
      "adjusted_category": "recommended",
      "comment": ""
    },
    "Dir 4.10": {
      "misra_category": "Required",
      "decidability": "n/a",
      "scope": "n/a",
      "rationale": [
        "UB",
        "DC"
      ],
      "applicability_all_rust": "No",
      "applicability_safe_rust": "No",
      "adjusted_category": "n_a",
      "comment": ""
    },
    "Dir 4.11": {
      "misra_category": "Required",
      "decidability": "n/a",
      "scope": "n/a",
      "rationale": [
        "UB",
        "IDB"
      ],
      "applicability_all_rust": "Yes",
      "applicability_safe_rust": "Yes",
      "adjusted_category": "advisory",
      "comment": ""
    },
    "Dir 4.12": {
      "misra_category": "Required",
      "decidability": "n/a",
      "scope": "n/a",
      "rationale": [
        "UB",
        "CQ"
      ],
      "applicability_all_rust": "Yes",
      "applicability_safe_rust": "Yes",
      "adjusted_category": "advisory",
      "comment": ""
    },
    "Dir 4.13": {
      "misra_category": "Advisory",
      "decidability": "n/a",
      "scope": "n/a",
      "rationale": [
        "DC"
      ],
      "applicability_all_rust": "Yes",
      "applicability_safe_rust": "Yes",
      "adjusted_category": "required",
      "comment": ""
    },
    "Dir 4.14": {
      "misra_category": "Required",
      "decidability": "n/a",
      "scope": "n/a",
      "rationale": [
        "UB",
        "CQ"
      ],
      "applicability_all_rust": "Yes",
      "applicability_safe_rust": "Yes",
      "adjusted_category": "required",
      "comment": ""
    },
    "Dir 4.15": {
      "misra_category": "Required",
      "decidability": "n/a",
      "scope": "n/a",
      "rationale": [
        "UB",
        "DC"
      ],
      "applicability_all_rust": "Yes",
      "applicability_safe_rust": "Yes",
      "adjusted_category": "required",
      "comment": "Rust implements IEEE-754"
    },
    "Dir 5.1": {
      "misra_category": "Required",
      "decidability": "n/a",
      "scope": "n/a",
      "rationale": [
        "UB"
      ],
      "applicability_all_rust": "Yes",
      "applicability_safe_rust": "Partial",
      "adjusted_category": "required",
      "comment": "not all safe Rust types are race-free"
    },
    "Dir 5.2": {
      "misra_category": "Required",
      "decidability": "n/a",
      "scope": "n/a",
      "rationale": [
        "UB"
      ],
      "applicability_all_rust": "Yes",
      "applicability_safe_rust": "Yes",
      "adjusted_category": "required",
      "comment": ""
    },
    "Dir 5.3": {
      "misra_category": "Required",
      "decidability": "n/a",
      "scope": "n/a",
      "rationale": [
        "DC"
      ],
      "applicability_all_rust": "Yes",
      "applicability_safe_rust": "Yes",
      "adjusted_category": "required",
      "comment": ""
    },
    "Rule 1.1": {
      "misra_category": "Required",
      "decidability": "Decidable",
      "scope": "STU",
      "rationale": [
        "UB",
        "IDB"
      ],
      "applicability_all_rust": "Yes",
      "applicability_safe_rust": "Partial",
      "adjusted_category": "required",
      "comment": ""
    },
    "Rule 1.3": {
      "misra_category": "Required",
      "decidability": "Undecidable",
      "scope": "System",
      "rationale": [
        "UB",
        "IDB"
      ],
      "applicability_all_rust": "Yes",
      "applicability_safe_rust": "Yes",
      "adjusted_category": "required",
      "comment": ""
    },
    "Rule 1.4": {
      "misra_category": "Required",
      "decidability": "Decidable",
      "scope": "STU",
      "rationale": [
        "UB",
        "DC"
      ],
      "applicability_all_rust": "No",
      "applicability_safe_rust": "No",
      "adjusted_category": "n_a",
      "comment": "this is specific to C versioning"
    },
    "Rule 1.5": {
      "misra_category": "Required",
      "decidability": "Undecidable",
      "scope": "System",
      "rationale": [
        "UB",
        "IDB",
        "DC"
      ],
      "applicability_all_rust": "Yes",
      "applicability_safe_rust": "No",
      "adjusted_category": "required",
      "comment": "this applies to deprecated APIs"
    },
    "Rule 2.1": {
      "misra_category": "Required",
      "decidability": "Undecidable",
      "scope": "System",